2025-11-20 16:51:35,728 - INFO - ================================================================================
2025-11-20 16:51:35,728 - INFO - PHASE 2: Extracting from diary Word documents
2025-11-20 16:51:35,728 - INFO - ================================================================================
2025-11-20 16:51:59,800 - INFO - ================================================================================
2025-11-20 16:51:59,800 - INFO - PHASE 2: Extracting from diary Word documents
2025-11-20 16:51:59,800 - INFO - ================================================================================
2025-11-20 16:52:25,842 - INFO - ================================================================================
2025-11-20 16:52:25,842 - INFO - PHASE 2: Extracting from diary Word documents
2025-11-20 16:52:25,842 - INFO - ================================================================================
2025-11-20 16:52:25,932 - INFO - Found 9 English diary files from 2009-2011
2025-11-20 16:52:25,932 - INFO - Found 43 other diary files (will skip)
2025-11-20 16:52:25,932 - INFO - Processing: B_2011Diary_En.docx
2025-11-20 16:52:25,987 - INFO - Extracted 10 entries from B_2011Diary_En.docx
2025-11-20 16:52:25,987 - INFO - Processing: C_2011Diary_En.docx
2025-11-20 16:52:25,997 - INFO - Extracted 0 entries from C_2011Diary_En.docx
2025-11-20 16:52:25,997 - INFO - Processing: B_Diary_En.docx
2025-11-20 16:52:26,002 - INFO - Extracted 9 entries from B_Diary_En.docx
2025-11-20 16:52:26,002 - INFO - Processing: D_Diary_En.docx
2025-11-20 16:52:26,023 - INFO - Extracted 0 entries from D_Diary_En.docx
2025-11-20 16:52:26,023 - INFO - Processing: A_Diary_En.doc
2025-11-20 16:52:26,026 - INFO - Extracted 0 entries from A_Diary_En.doc
2025-11-20 16:52:26,026 - INFO - Processing: D_2010Diary_En.docx
2025-11-20 16:52:26,040 - INFO - Extracted 12 entries from D_2010Diary_En.docx
2025-11-20 16:52:26,040 - INFO - Processing: B_2010Diary_En.doc
2025-11-20 16:52:26,051 - INFO - Extracted 29 entries from B_2010Diary_En.doc
2025-11-20 16:52:26,051 - INFO - Processing: A_2010Diary_En.docx
2025-11-20 16:52:26,060 - INFO - Extracted 8 entries from A_2010Diary_En.docx
2025-11-20 16:52:26,060 - INFO - Processing: C_2010Diary_En.docx
2025-11-20 16:52:26,082 - INFO - Extracted 0 entries from C_2010Diary_En.docx
2025-11-20 16:52:26,085 - INFO - 
================================================================================
2025-11-20 16:52:26,085 - INFO - Phase 2 complete!
2025-11-20 16:52:26,085 - INFO - Total entries extracted: 68
2025-11-20 16:52:26,085 - INFO - Output saved to: /media/shawn/191c3b96-5fa5-4d0d-8805-0cf05d3d8468/synology/Adela/TRAP-WD-2020-04/claude_extraction/outputs/phase2_roles.csv
2025-11-20 16:52:26,085 - INFO - ================================================================================

2025-11-20 16:52:26,085 - INFO - Summary by diary:
2025-11-20 16:52:26,085 - INFO -   B_Diary_En.docx: 9 entries
2025-11-20 16:52:26,086 - INFO -   B_2010Diary_En.doc: 29 entries
2025-11-20 16:52:26,086 - INFO -   D_2010Diary_En.docx: 12 entries
2025-11-20 16:52:26,086 - INFO -   A_2010Diary_En.docx: 8 entries
2025-11-20 16:52:26,086 - INFO -   B_2011Diary_En.docx: 10 entries
2025-11-20 17:45:49,588 - INFO - ================================================================================
2025-11-20 17:45:49,601 - INFO - PHASE 2: Extracting from diary Word documents
2025-11-20 17:45:49,601 - INFO - ================================================================================
2025-11-20 17:45:49,692 - INFO - Found 9 English diary files from 2009-2011
2025-11-20 17:45:49,692 - INFO - Found 43 other diary files (will skip)
2025-11-20 17:45:49,692 - INFO - Processing: B_2011Diary_En.docx
2025-11-20 17:45:49,817 - INFO - Extracted 10 entries from B_2011Diary_En.docx
2025-11-20 17:45:49,817 - INFO - Processing: C_2011Diary_En.docx
2025-11-20 17:45:49,843 - INFO - Extracted 0 entries from C_2011Diary_En.docx
2025-11-20 17:45:49,843 - INFO - Processing: B_Diary_En.docx
2025-11-20 17:45:49,875 - INFO - Extracted 9 entries from B_Diary_En.docx
2025-11-20 17:45:49,875 - INFO - Processing: D_Diary_En.docx
2025-11-20 17:45:49,905 - INFO - Extracted 0 entries from D_Diary_En.docx
2025-11-20 17:45:49,905 - INFO - Processing: A_Diary_En.doc
2025-11-20 17:45:49,927 - INFO - Extracted 0 entries from A_Diary_En.doc
2025-11-20 17:45:49,927 - INFO - Processing: D_2010Diary_En.docx
2025-11-20 17:45:49,951 - INFO - Extracted 12 entries from D_2010Diary_En.docx
2025-11-20 17:45:49,951 - INFO - Processing: B_2010Diary_En.doc
2025-11-20 17:45:49,973 - INFO - Extracted 29 entries from B_2010Diary_En.doc
2025-11-20 17:45:49,973 - INFO - Processing: A_2010Diary_En.docx
2025-11-20 17:45:50,007 - INFO - Extracted 8 entries from A_2010Diary_En.docx
2025-11-20 17:45:50,007 - INFO - Processing: C_2010Diary_En.docx
2025-11-20 17:45:50,028 - INFO - Extracted 0 entries from C_2010Diary_En.docx
2025-11-20 17:45:50,032 - INFO - 
================================================================================
2025-11-20 17:45:50,032 - INFO - Phase 2 complete!
2025-11-20 17:45:50,032 - INFO - Total entries extracted: 68
2025-11-20 17:45:50,032 - INFO - Output saved to: /media/shawn/191c3b96-5fa5-4d0d-8805-0cf05d3d8468/synology/Adela/TRAP-WD-2020-04/claude_extraction/outputs/phase2_roles.csv
2025-11-20 17:45:50,032 - INFO - ================================================================================

2025-11-20 17:45:50,032 - INFO - Summary by diary:
2025-11-20 17:45:50,032 - INFO -   B_Diary_En.docx: 9 entries
2025-11-20 17:45:50,032 - INFO -   B_2010Diary_En.doc: 29 entries
2025-11-20 17:45:50,032 - INFO -   D_2010Diary_En.docx: 12 entries
2025-11-20 17:45:50,032 - INFO -   A_2010Diary_En.docx: 8 entries
2025-11-20 17:45:50,032 - INFO -   B_2011Diary_En.docx: 10 entries
2025-11-20 17:46:15,480 - INFO - ================================================================================
2025-11-20 17:46:15,481 - INFO - PHASE 2: Extracting from diary Word documents
2025-11-20 17:46:15,481 - INFO - ================================================================================
2025-11-20 17:46:15,572 - INFO - Found 9 English diary files from 2009-2011
2025-11-20 17:46:15,572 - INFO - Found 43 other diary files (will skip)
2025-11-20 17:46:15,572 - INFO - Processing: B_2011Diary_En.docx
2025-11-20 17:46:15,621 - INFO - Extracted 10 entries from B_2011Diary_En.docx
2025-11-20 17:46:15,621 - INFO - Processing: C_2011Diary_En.docx
2025-11-20 17:46:15,631 - INFO - Extracted 0 entries from C_2011Diary_En.docx
2025-11-20 17:46:15,631 - INFO - Processing: B_Diary_En.docx
2025-11-20 17:46:15,636 - INFO - Extracted 9 entries from B_Diary_En.docx
2025-11-20 17:46:15,636 - INFO - Processing: D_Diary_En.docx
2025-11-20 17:46:15,655 - INFO - Extracted 0 entries from D_Diary_En.docx
2025-11-20 17:46:15,655 - INFO - Processing: A_Diary_En.doc
2025-11-20 17:46:15,658 - INFO - Extracted 0 entries from A_Diary_En.doc
2025-11-20 17:46:15,658 - INFO - Processing: D_2010Diary_En.docx
2025-11-20 17:46:15,670 - INFO - Extracted 12 entries from D_2010Diary_En.docx
2025-11-20 17:46:15,670 - INFO - Processing: B_2010Diary_En.doc
2025-11-20 17:46:15,681 - INFO - Extracted 29 entries from B_2010Diary_En.doc
2025-11-20 17:46:15,681 - INFO - Processing: A_2010Diary_En.docx
2025-11-20 17:46:15,690 - INFO - Extracted 8 entries from A_2010Diary_En.docx
2025-11-20 17:46:15,690 - INFO - Processing: C_2010Diary_En.docx
2025-11-20 17:46:15,711 - INFO - Extracted 0 entries from C_2010Diary_En.docx
2025-11-20 17:46:15,715 - INFO - 
================================================================================
2025-11-20 17:46:15,715 - INFO - Phase 2 complete!
2025-11-20 17:46:15,715 - INFO - Total entries extracted: 68
2025-11-20 17:46:15,715 - INFO - Output saved to: /media/shawn/191c3b96-5fa5-4d0d-8805-0cf05d3d8468/synology/Adela/TRAP-WD-2020-04/claude_extraction/outputs/phase2_roles.csv
2025-11-20 17:46:15,715 - INFO - ================================================================================

2025-11-20 17:46:15,715 - INFO - Summary by diary:
2025-11-20 17:46:15,715 - INFO -   B_Diary_En.docx: 9 entries
2025-11-20 17:46:15,715 - INFO -   B_2010Diary_En.doc: 29 entries
2025-11-20 17:46:15,715 - INFO -   D_2010Diary_En.docx: 12 entries
2025-11-20 17:46:15,715 - INFO -   A_2010Diary_En.docx: 8 entries
2025-11-20 17:46:15,715 - INFO -   B_2011Diary_En.docx: 10 entries
